{
  "ablations": {
    "observation_delay": false
  },
  "budget": {
    "max_steps": 60
  },
  "cell_id": "c_ab12cd34",
  "config_digest": "ab12cd34",
  "environment": {
    "config": {},
    "plugin": {
      "plugin_id": "formal-lab.env.ir-world",
      "version": "1.0.0"
    }
  },
  "model": null,
  "participants": {
    "a": {
      "config": {},
      "plugin": {
        "plugin_id": "formal-lab.planner.z3-bounded",
        "version": "2.0.0"
      }
    },
    "b": {
      "config": {},
      "plugin": {
        "plugin_id": "formal-lab.example.scheduling.edd-dispatch",
        "version": "2.0.0"
      }
    }
  },
  "rules": null,
  "rules_enabled": true,
  "scenario_id": "scn_1",
  "scenario_revision": 2,
  "seed": 3,
  "split": "acceptance"
}
